text,label1,label2
"Astonishingly good value!  This is a roadside ""joint"" where you order at the counter and they bring you your food ten minutes later.  It does have some character of its own, particularly due to the friendly and helpful staff.  The reason for the five stars was the sandwiches, particularly the Philly cheese steak.  They are huge, full of meat, tasty, and decently-priced.  My wife and I made the mistake of ordering a 20 inch to split, thinking we would stack all the meat in half the sandwich.  We couldn't - there was too much meat.  We finished half and took the rest.  Hint: At least when we visiting, the soda dispensing machine had only five flavors, all sugared and none diet.",Business Category: Restaurants,Review Stars: 5.0
"I was referred to this restaurant by a co-worker, so i decided to give it a try! First off i have to say that the employees were very nice, and attentive! The location is open air, but the employees didnt wear masks, which was surprising. My gripe was the brisket was very dry, and the green beans were very salty. and for what we got the price was very high!  I try to give a place more than one chance, so I may try it one more time to make sure this experience wasn't a one off..",Business Category: Restaurants,Review Stars: 3.0
"1 for a lost reservation and a don't care attitude  4 for food and service. We had a large group for my 7 yr old's birthday. We started with the cheesey garlic bread appetizer for the table and they were a huge hit, then on to soup and salad, I had the minestrone soup and it was great, then on to dinner and it was the chicken Caesar salad for me, it was average at best, and then topped off with ice cream",Business Category: Restaurants,Review Stars: 3.0
"Yipes. I really want to like this place for dinner. After all,good pizza, good service, good food, BYOB, entertainment by a clarinet /bass duo, but I think they believe that customers will come and wait 45 minutes after reservation time, in a very hot, tiny waiting area and by overbooking,all will be fine for them.  Well it isn't, as there are other places in town. I gave no problem with a 15 minute wait, but beyond that means overbooking, and disrespect. Other restaurants do 30-45 minutes segments, ok. I can accept that. To make matters worse, the place is very very warm and without a door opened even the old of winter isn't good enough to cool off place.  After a 45 minute wait,a friend of the owner took our table for 4 and we were placed in a small booth where groups of 2 were seated.  After realizing that we waited 45 minutes for a table for four, being seated on comfortably at a Booth meant for two, we got up and left and went to dolce carini. Although we had to pay for wine, we were comfortable and entertained by piano and served great food by A very hospitable server. A great option after a very frustrating experience.",Business Category: Restaurants,Review Stars: 2.0
"Viet Pho shares a dining area with Port O Subs in the run down Shoppers  Square Mall.  I had a couple vietnamese sandwiches with bbq pork....very fresh and tasty. Good value too compared to the hordes that kept going to Port O Subs. I didnt understand why people wouldnt try a local joint, especially when the sandwiches were much fresher and tastier.  Owner was very friendly. Had a banana smoothie that was phenomenal.  Not the best vietnamese I've had, but pretty good.",Business Category: Restaurants,Review Stars: 4.0
"Olive Garden has been one of the most consistent chain restaurants I've been to. It's hard to give them 5 stars because it's a chain, and all of the food is just packed with sodium.   I always get the 2 for $25 dinner. I absolutely love unlimited soup and salad. My go-to soups are chicken and gnocchi and zuppa toscana. I can probably eat a whole bowl of salad by myself after a tournament.  All the entrees the great. The Tuscan Garlic Chicken is a huge fan favorite, and I always get that as the entree in the 2 for $25 deal. The rest of the entrees are also really good.",Business Category: Restaurants,Review Stars: 3.0
"First of all the fries with parmesan reggiano are to die for.  OMG.  For lunch I went with the duck sandwich which was too dry for my taste, I wouldn't recommend.  My friend had the cuban which looked much better. We finished off the meal with the krispy kreme bread pudding.  I'm so not sharing next time, this is the best dessert ever.  You'll go right to food heaven.  Their dessert menu looks amazing, it was hard to just choose one.  I'll come back but I'll order the main meal better.  Or just get a few desserts...",Business Category: Restaurants,Review Stars: 3.0
"Pizza is good but service sucks. Lacking a formal method for seating. If you go when it's crowded there is no tracking of who got there first. We came in and ordered behind another family so we were second in line and given a number to pit on our table. But no tables were available so we wait along with other family before us.   I'm watching people come in and snagging tables as soon as it's vacated. Then others arrive and they go up front to order. I ask the hostess and she says they already ordered, which was not true. The other family in front if us noticed this also and began complaining. The finally admitted the mistake and said you are supposed to order first and then wait for a table.   No instructions anywhere or no guidance by staff. Then when asked they didn't seem to care until about a dozen people were complaining. Poor customer service. It'll be hard for us to go back. Too many other good pizza places in the area with better service.",Business Category: Restaurants,Review Stars: 2.0
"Excellent!  The *best* burrito I've ever had. I actually didn't even like burritos until I had the one they serve! Soooo good! Completely authentic cuisine, and I didn't see an English menu as some of the previous reviewers stated, though there were big pictures on the walls of the food items. I simply talked to the waitress (who was super nice and spoke English) to order. It's cool to see the Mexican beer and soda stuff, even though I just got a water. My boyfriend got an apple soda that was actually pretty good!",Business Category: Restaurants,Review Stars: 5.0
"How many yelp stars should be given to an establishment for being cool (but mostly just that and nothing more)?   Annnnd I've decided that three seems like a good answer to my own question. I've been at Penn for four years now, which means that I've probably walked by the Pod probably like 2360 times, even though I hadn't ever been inside. I wasn't particularly drawn to it from what I could see on the outside, but when I found out that our RA/GA staff end-of-year celebration this year was at the Pod, I became pretty eager... I guess my curiosity over this place had grown over time.    So, when we came in May for our staff celebration, they had set up two long tables to accommodate our large staff group. It's surprisingly spacious and I thought the type of futuristic look that they were going for was okay (even though I wasn't a fan of their bathroom design; the tiny metallic pods were kinda eerie to me).   My main impression of their food was that it was trendy, not being particularly good or bad. I might have had stronger opinions if this was coming out of my own wallet, but tbh I didn't even know the cost of what I was eating (thank you Ware!). I did really enjoy the mocktails that they offered, including their ""vanilla ginger cream soda"" and sparkling ""white bubble teas"". Oh, and they had some taro cake/ice-cream dessert topped with colorful crunchy treats that was pretty unique and tasty as well.   All in all, I'm thankful that my job allowed me to experience this place and it is one of the few fancier places in UC, but if I wanted to spend a whole lot of money on food, there's a lot of other establishments that would probably win out.",Business Category: Restaurants,Review Stars: 3.0
I had the worst experience here the other day! They served me brown lettuce :( the girl who took our order was miserable! Felt rushed to make a decision. My friends and I will never go back. Nothing sweet about this place!,Business Category: Restaurants,Review Stars: 1.0
"4 3/4, We visited Bonefish, Friday evening 1/23/15, 6:15 reservation.  Fast, friendly sitting.  Our server, Jackie, her 1st or 2nd night working. She deserves 5plus.  Could not of been better service, friendly, great smile, sincere concern for us to have a great dinner.  My food could of been hotter, taste great!  Had trout with herb basil sauce.  Thought meal came with seasonal veg. not sure was it was, the jasmine rice was very good.  My husband had a kobe burger, noticed the bacon was missing, but not until he had eaten the entire burger.  Jackie took it off the bill, she insisted doing this even though it was not a big deal to us.  Wonderful service and great meal.  We will return! Dave and Donna Grubb",Business Category: Restaurants,Review Stars: 4.0
"Wow wow wow! Where to begin I've pretty much had everything on this menu. Quality quality quality describes each uniquely crafted savoring ingredient. Their cheesesteak is a personal favorite of mine. Delicious roll, tons of flavorful meat, and tasty cheese. You can't go wrong with anything on this menu and the service is excellent. One last thing, JIM IS A CUTIE PIE",Business Category: Restaurants,Review Stars: 5.0
We are definitely critics when it comes to Greek food. This restaurant is as authentic as they come. You will not be disappointed!  Prices are very reasonable and portions will not leave you hungry. Add an ouzo after dinner drinks and you will have experienced a truly remarkable Greek evening.  The staff goes out of their way to ensure you do not want f or anything. Ask for Jamie. You will have the best experience one can have for an evening out.,Business Category: Restaurants,Review Stars: 5.0
"So I have always considered this restaurant a Reno Staple but after my experience tonight I am not sure why.   When I lived closer to the restaurant about 9 years ago I ate here probably 2 times a week and brought all my friends and family here however the food has changed and the service was just mediocre today.   The busser/water gal was absolutely amazing, she was tentative, friendly and busting her butt to make sure we had a great experience along with the other guests in the restaurant.     The crab Rangoon was good it was more than just cream cheese which is surprisingly hard to find in Reno.  The chicken chow mein did not have much chicken but was good.   The beef broccoli was good  and the sesame chicken was good had a little extra kick which was nice.    Yes this restaurant is being covid compliant and taking reservations which is nice for these unprecedented times.",Business Category: Restaurants,Review Stars: 3.0
"This place made me feel like I was in Japan! More than the food, the ambience makes this place great! I ordered the impossible sando. I didn't really know what to expect but it was delicious! Very unique and unlike anything I've tasted before. Also, drinks were delicious. It is definitely pricey and not enough food for the price. But, overall I would revisit this place. Also, seating is limited!",Business Category: Restaurants,Review Stars: 4.0
"Super great food, the sprouts were out of this world. The service was above average and well we over ordered because the menu was so inspirational. What I will tell you is there is a ton of salt in the food. I was sucking down water about an hour after leaving the restaurant. Also several people liked the picture I posted the next day, telling me that something is up. The food is great but it will raise you BP",Business Category: Restaurants,Review Stars: 4.0
"a cute place with outdoor seating in a quiet part of Philly. I liked the breakfast sardine sandwich,  brussel sprouts, and collard greens mire than the actual sardines.  I also recommend the boozy cider (bourbon + bitter + simple syrup + cider) - the mixing of alcohol means you only need one drink to feel it",Business Category: Restaurants,Review Stars: 4.0
The food is good.  The service not so much.  It isn't that the waitress isn't friendly or anything.  It's because both times I've been here there has only been one waitress covering the entire diner.  So if you're looking for good food with slow service this is your place.,Business Category: Restaurants,Review Stars: 2.0
"Outstanding ahi tuna, nice atmosphere (comfortable yet not a hole in the wall) but terrible lemon drop martinis.  Probably a great place for those with a stomach for beer, unfortunately I haven't mastered that art yet so for now, I'll simply enjoy their food, which seems to be on a higher breed of pub food.",Business Category: Restaurants,Review Stars: 4.0
Lost quite a few regular customers today. One and a half hour wait for simple food. Manager (found out it was owner) was horribly rude and did not care to make service right. People had been saying this place was going down and now I believe them. Their loss.,Business Category: Restaurants,Review Stars: 1.0
"They make the most delicious sandwiches in Abington. This couple seriously knows what they are doing. I had the Roslyn Roast Beef and wanted to go back there to get another one after I ate the sandwich. They are South Philly based so if you like roast pork, roast beef, etc then this is the perfect place for you. Beware though, the place is super small inside and no place for you to eat. It is take out only pretty much. Nonetheless, five stars for this amazing joint.",Business Category: Restaurants,Review Stars: 5.0
"Gallagher's is definitely a, ""Winner, Winner - Chicken Dinner"". I've heard great things about Gallagher's for years, so for the celebration of my friends 29th Anniversary of their 29th birthday, we decided to do a road trip to Waterloo. It took us only a half hour from downtown STL and it is so worth the drive. It was less time then driving out to west county.  Sunday is Family Style Chicken Dinner for $12.95. Family Style is the polite way of saying, ""It is all you can eat"". Our table was covered with a platter of crispy & juicy fried chicken, a bowl of fresh green beans with ham, another bowl of corn custard and yet another bowl of mashed potatoes and finally a gravy boat of milk gravy. Then when you are done stuffing yourself with all these home cooked delights, they offer you a piece of Susie's Sheet Cake for dessert. The flavor changes on the regular, so our flavor was Blueberry Lemon.  Fried Chicken: Large pieces, crispy crust & juicy inside, not spicy or overly salty - just perfectly seasoned.   Green Beans: Simply seasoned with ham, salt and pepper  Corn Custard: Unique in its' own way - everyone loved it once they tried it.   Mashed Potatoes - Whipped heavenly, with a very lumps to show it truly is homemade.   Milk Gravy - Life doesn't get any better then gravy made from fried chicken drippings.   Sheet cake: The sweetness and tartness of blueberries and lemon made a great finale.   The whiskey and craft beer menus will blow you away. You'll never expect the variety they offer from a small town restaurant. The birthday honoree loved their Whiskey Sour and my Manhattan had good flavor, but a tad too much vermouth for me.   The service was your typical down home, small town friendly with a twist. Some of the staff was clean as a whistle, boy/girl next door type and others were hipster/lumbersexual. Making for a nice mix of service with a smile.   I loved the fried chicken dinner and cannot wait to go back and try their ribeye.   When: April 17, 2016 Why: Friends Birthday Dinner",Business Category: Restaurants,Review Stars: 4.0
"We have been to Villaggio's about half dozen times and after eating there again last night I wanted to write a review.  They consistently provide a high quality meal with friendly service, reasonably priced. Besides the great food, one of my favorite things about this restaurant is the acoustics - you can actually speak to the person(s) you are dining with without yelling - it is a large place, tables rather close together (not my favorite thing), but somehow the noise level is tolerable.  I typically order the pappardelle bolognese and it is perfection - homemade pasta is simply the best.  Great place for a dinner out with friends or family.",Business Category: Restaurants,Review Stars: 4.0
"The price range is okay. The food was decent. I like the ordering system but the service sucks. The first time I went, it was okay but the second time was a disaster. They messed up our order and then they forgot another order. Also there was hair in my food... and a sticker that says thursday on it. All the server did was say it was gross and took it away. In the order they forgot, they ran out of sauce and put a substitute without even asking and it did not go well with what I ordered.",Business Category: Restaurants,Review Stars: 2.0
"The food here is decent, a bit over priced I found the the starters we're better than main dishes. My favorite dish was the crab cakes. They were amazing.",Business Category: Restaurants,Review Stars: 3.0
"Yeah, I tried it and it wasn't for me. I was expecting something more along the lines of Mellow Mushroom and their gluten free pizzas. I get the concept is flatbread but there was a lack of seasoning in there that just through the entire pizza off.  They do have great toppings but the dough itself was flat, tasteless, and too ""wet"" for me. Hey, plenty of other yelpers love this place so don't just take my word: go out and try it for yourself.",Business Category: Restaurants,Review Stars: 3.0
Waited three hours to get my food. My order got messed up and the service was horrible after the three hours passed i didnt even want my food anymore... oh but it gets better. once i ate my food from this nasty place I GOT FOOD POISONING. yes. food poisoning. save yourself and DO NOT EAT HERE.,Business Category: Restaurants,Review Stars: 1.0
"Holy smokes, the food here is really tasty! I'd happily eat anything on the menu, but the spectacular elotes would keep me coming back.",Business Category: Restaurants,Review Stars: 5.0
"As a visitor from CA, I wasn't expecting much from a Mexican restaurant in Tennessee, and I got what I was expecting. The food is decent but definitely not authentic, and the atmosphere is more like a small town sports bar than a Mexican restaurant.",Business Category: Restaurants,Review Stars: 2.0
"I really like Skewers for their fresh food, quality ingredients, and small size appeal. Their prices are a little on the higher side, but their food is always great. Since the place is so small, occasionally the chef having a bad day can spill out into the restaurant. Infrequently the younger girls taking the orders can seem distracted or too busy to give you a warming welcome. Those complaints are minor in the grand scheme of things - Skewers is a great place to grab a small bite to eat.",Business Category: Restaurants,Review Stars: 4.0
"First time there, we sampled the sushi rolls and Chinese specials.    The rolls had excellent flavor, but they could have been rolled tighter since they tended to fall apart.    We had Pork with Garlic Sauce -- a good way to see how the kitchen handles a basic staple recipe.  It was authoritatively spicy, with flavor as one would expect.    We also had Roast Crispy Duck in Plum Sauce from the Chef's Special section of the menu.  It had a very pleasant flavor, although the crispy coating tended to detach from the duck.    Overall, an OK experience.  We expect to visit there again to sample more of the menu.  One obvious way to improve: This is a BYOB.  They need to get a liquor license.",Business Category: Restaurants,Review Stars: 3.0
"Second try for the Gastropub. The serving staff were prompt and friendly. The food was pricey and a mixed bag.  We ordered a couple of Philly Cheesesteaks with sides. The sandwiches where tasty but not incredible - not if you really know what a Cheesesteak is. Seemed a bit greasy too. Still, for ""movie food,"" not bad. The fries where crisp. The tater tots where awful, kind of soggy. Probably just a bag of frozen tots.  Most disappointing was the beer. I ordered a Coppertail Unholy, one of my favs from a local brewery. I was served in a 6 ounce plastic cup, which is ridiculous for this beer. Anywhere else in town you'll get the usual 12 ounce pour minimum.  Total bill about $45, which is just crazy for one eentsy-teensy beer and two Cheesesteaks. I think I'm done trying this theatre restaurant. Besides, the theater seats don't have side tables, and you have to bring the food into the theater yourself in to-go boxes... might as well stick to full-service places like Cinebistro or Cobb.",Business Category: Restaurants,Review Stars: 2.0
"I was an oyster virgin when i arrived at Oyster House. I was nervous, excited, i wasn't sure if it would hurt.... it didn't.  We had a great set of bartenders during the time of day when only the raw bar was available so it was kinda like.. sh*t or get off the pot!!! The bartenders offered up some great reccomendations, and i'll never look back. I now know i adore oysters, with anything on em... or nekked.   The shirmp cocktail was also banging, and the cocktail sauce was spicy and sweet and buttery. really great. I can't wait to go back! However, i bascially came in hungry, and left hungry for $100... but it was fun to do!",Business Category: Restaurants,Review Stars: 4.0
Very disappointing.  They cannot easily accommodate large parties and cram too many people together. It's stifling hot in the restaurant to a pint of discomfort.  Food and chef were ok.  Nothing to be impressed with.  I would not return.,Business Category: Restaurants,Review Stars: 2.0
"I have been to this location twice now, and both times it was disappointing. Tonight I got there at 7:30, and the people working behind the counters were busy closing down. They had not much out that looked fresh. There was only a few leg pieces of fried chicken left, and they had moved them from the normal spot and shut down the chicken area already.   One of the reasons I went there was for the ribs I had seen on their ads. Well that special was over last week I guess, since there were no ribs at all. One of the other things I like at this place is their pot roast. The pot roast here was more fat than meat, and was not cooked with the vegetables, so the flavor just wasn't there.   Since there were no ribs I tried to get a steak. It took two minutes to get someone to get me a piece of steak. They would not grill a fresh steak, since they had shut the grill down. They did this before 8 pm, and the restaurant is open until 10 pm.   I was not able to eat the salad I made, because someone had put blue cheese into the ranch dressing. I heard several people complain about this, but nothing was done to fix the issue.   The staff of a restaurant can make or break a place, and the staff at this store is working to get their store shut down.  They need to fire most of the crew.",Business Category: Restaurants,Review Stars: 2.0
"I remembered Aunt Polly's being great when I was a kid.  I don't think I'd had any food from there since the 90s.  It was on my list of places to try ever since I came back to the Indy area.  After moving back to the east side after twenty-plus years, I finally got some Aunt Polly's delivery just before the new year.    It was a Friday night, and they were apparently extremely busy.  I was asked to hold, and the phone was set down where I could hear several other orders being taken.  I decided to hang up and called back a little later, hoping to let the rush die down.  I was able to place my order right away when I called back.  I ordered way too much, but I was entertaining kids.  The wait was over an hour and a half.  The delivery driver was nice.  The food on the other hand was not so great.  One of the pizzas seemed undercooked with a heavy, doughy crust and gooey cheese, while the other two spent a little too much time in the oven.  They had dark, tough cheese and large charred pieces falling off the underside.    The breadsticks were the worst I have ever had.  Heavy, undercooked, and inedible.  I even tried to bake the breadsticks longer in the oven later on, but I ultimately threw most of them away.  Some of the food seemed to have sat around a while longer than the rest.  Along with the cold marinara and nacho cheese that came with the breadsticks, the breaded mushrooms I got were lukewarm, soggy, and falling apart.  A far cry from what I remember way back when.  Their mushrooms used to be my favorite thing on the menu.  I didn't try them myself, but the mozzarella sticks seemed to be a hit.  They appeared to be hot and crisp.  The leftover mozz sticks reheated well along with the breaded tenderloin.  The tenderloin was eaten by the biggest food critic I know, so it must have been good since there were no complaints.  The best thing we received was the side salad.  Even though it was made with Iceberg, it was fresh and came with a lot of toppings.  It was better than the side salads at most places.  Of course, the cheapest thing I ordered was the star of this mess.  It was highly disappointing to drop so much money and receive so little especially when most of the food was barely edible.   My memories of Aunt Polly's have been permanently crushed.  I doubt that I would order from here again.  Such a waste.  I still cringe with regret.",Business Category: Restaurants,Review Stars: 2.0
