text,label1,label2
"I must preface this review with a clear statement that I am an espresso fan.  I love great, dark espresso.  This coffee shop is a bit more than an hour from my house, and I drove here specifically to try out a new high-end coffee roaster in the area.  It's definitely not bad!  In fact, it's certainly better than average.  If there were 'half stars,' I would very comfortably rate it a 3.5.  But to me, a 4 star review would be something that I would drive an hour to visit again.  I'm sorry to say it, but unless I learned of an advancement in their roasting, I would not drive that far.  Stop by if I'm in the neighborhood?? ABSOLUTELY!  Decor is great.  Lots of coffee shop personality.    My breakfast sandwich was ok.  I had the egg, roasted pepper and Kennet mushroom sandwich.  It was very sweet, and I don't care for sweet sandwiches - but that's probably my own fault for ordering the peppers.    My espresso was incredibly light.  That is not my expectation for espresso, and I don't think that's my fault at all.  Most folks expect a very dark, robust drink when ordering espresso.  To the credit of the counter staff, I asked to buy their two darkest roasts, one pound each.  One of them said ""everything we roast is very light.""  ...yup!!  I sure do wish them luck, and I'm sure that tons of folks will adore the super-light roasts.  But for this coffee but, I'm more than a little sad it wasn't on par with La Colombe or Ultimo.  Hopefully they grow into that!!!  Addition: I don't read other reviews before writing mine.  After posting, I read a few others.  Service issues were a common theme for a few.  There are three young workers here on a Saturday morning.  They are totally just 'hanging out.'  Not a bad vibe if you are looking to attract college kids who don't really expect much in terms of quality service.  For a more high end place, they need better training and supervision.  A great manager or an owner looking over their shoulders would probably mean fewer dirty tables, a cleaner back counter area, and more of a ""we want to WOW you"" approach.  Definitely another area for improvement.  I think the problem is a disconnection from the look of the place and the running of it.  So much potential, short on results.",Business Category: Restaurants,Review Stars: 3.0
"Meh... As a Vermicelli bowl girl... I wasn't a big fan of Pagolac.  I much prefer Golden Bird (just a few doors down on the same side of the street).  I don't know if it was an off day or what, but my grilled steak was chewy and had a lot of stringy fat... something I just cannot deal with!  The spring rolls were average...  My husband had Pho... and even he wasn't super impressed.  Given the popularity of this place... perhaps we should try it again?    But when we love Golden Bird so much... We can't see the reason to try again.",Business Category: Restaurants,Review Stars: 2.0
"I have been here two times now & it never disappoints! The wait was about 35-45 minutes but we had 16 people and it was right during brunch hour! Making a reservation wouldn't be a bad idea by any means.  The restaurant was very clean, our food came super fast, and the service was outstanding. Free coffee and water while your waiting too!  The power wrap was outstanding! Egg whites, fresh turkey, spinach, cheese, and mushrooms in a bright red wrap! To die for. Everyone that we went with LOVED their food. Thank you First Watch for the delicious and healthy food!",Business Category: Restaurants,Review Stars: 5.0
Worst Pho I have ever tasted..! This wasn't beef broth.. just water with flavoring. So bad that I just left after one spoonful.,Business Category: Restaurants,Review Stars: 1.0
"Service was good! We got the calamari, spaghetti and meatballs, and the spicy lasagna. First time here, will come back!",Business Category: Restaurants,Review Stars: 5.0
Good hot queso with chorizo.  Fast and friendly.  The only downer was my  margarita on the rocks very strong on the mix.  Probably would be better frozen.,Business Category: Restaurants,Review Stars: 4.0
What can I say?  Walts is yummy.  I would suggest cutting back on the salt.  There have been times when I felt it was almost inedible due to the sodium content.  So...cut back on the salt and the chicken is perfection.,Business Category: Restaurants,Review Stars: 3.0
"The food was overpriced, terrible, and obviously microwaved. The fish was chewy, dry, and awful; the rice it was on was sitting around for too long and had hard rice grains due to microwaving or just from sitting out. A manager came around and asked how the food was, he knew it was bad, and he did nothing with the information. Won't go back. Maybe I ordered the wrong thing, but I doubt it.",Business Category: Restaurants,Review Stars: 1.0
"Average Italian food. I've been here twice, both for large dinner parties of at least 15 people. I wouldn't come here for a date with my husband or bring family as there are other Italian restaurants in which the food is superior. However, this place is great if you need to make a reservation for a large group.   It is important to note that you order family style. Everything, from salads to pasta and entrees, are available in small or large. Small feeds two people, large feeds four. My husband and I can usually agree on a dish to share.  Our last visit, we ordered the spicy chicken rigatoni. It was OK. Not really spicy in either of our opinions, and the sauce was sparse. I did not really taste much garlic or crushed red pepper. We also split a caprese salad, which was good, but then again, it's hard to mess that one up!  Service was good for a large group.",Business Category: Restaurants,Review Stars: 3.0
"Tonight we again visited this establishment.  We keep giving them a chance time and time again because we keep hearing and see them trying.  The food is good, I had the Mediterranean veggie burger ( which is what I have ever time I go here). The burger itself is good, I ask for it to be extra hot ( temperature) because being a veggie burger I know it is frozen.  This time it was warmer than last time, so I wold say it was better.  The service that is a whole different story.  First he young lady taking our order was a little overwhelmed.  Maybe she was new or the fact that is was a Thursday and there were many people there? Our order took over 20 minutes to arrive, then a basket of fries arrived, w e waited an additional 10 minutes, before we received the remaining of the order.  We were 7 people, so nothing too crazy ( at least we thought).  A member of our party ordered a beer, which was not delivered, so he had to go up and get it from the counter.  Not sure why it was not served at the time he ordered. The only reason I can ink of was the fact that the order taker may have been to young? At the end of the meal, the kids wanted shakes, we ordered 1 shake which took sometime, but no big deal.  Then 2 additional shakes were ordered, that took a LONG time.  Enough to make us go and cancel the order, we figured 10 minutes for 2 shakes that was a it too long.  As we were canceling the shakes they came out.  As we started to walk away the manager trainee ( Dave, I think that was his name) came out to the parking lot and gave us the money for the shakes and also gave us 2 orders of fries. He said "" he was the manager trainee and wanted us o be happy and return"". That was the only reason they got a 3 star rating.  I would suggest either better training for he staff or new staff. Maybe that is sit too harsh, but we were not the only table with order issues.  If they want to survive in the restaurant business they will need to step it up, specially at their prices.",Business Category: Restaurants,Review Stars: 3.0
"I have been to this Outback many times and always have a positive experience. As a special treat to my girls, we went to Outback for lunch.   We were promptly greeted at the door and seated immediately in a very comfortable booth.   Our server's name was Crystal and she did a wonderful job! We got the layered cheese fries with extra ranch. It almost seems like my girls practically drink the ranch from here because they love it so much! Crystal was on it and brought us plenty of ranch.   As my meal I got the Chicken tender platter with my chicken smothered in buffalo sauce with blue cheese dressing on side. It was very delicious!",Business Category: Restaurants,Review Stars: 4.0
"I was once told my an employee of TD to NEVER eat here.  With that being said, I can disclose that I wish I could eat the mini hamburgers here everyday. For many unnamed reasons, I'm sure I should not - but they're just that good. Not to mention, they are the closest thing you will get to a Krystal burger unless you want to go to Bourbon Street and spend an obscene amount of money on a tiny burger that shouldn't be priced at more than 50 cents. (I'm not driving to Lafayette for Krystal burger, would you?)   Their desserts, while still good, have gone downhill over the years. You can purchase better desserts at Robert's, SAMs, Costco, or one of our amazing local bakeries if you feel like spending a little dough (pun-intended).  I used to love their doughnuts, and I haven't found any other doughnuts quite like theirs. You should know that they're the thick kind, though. There's nothing wrong with that; people just seem to prefer the right off the conveyer belt, lighter-tasting doughnuts these days.  The employees aren't the friendliest in town, but it's clear they don't have to be. This tastee has existed on this corner for as long as I can remember. My neighbors - past and present - have kept this place a staple in their lives. If you're around and need a quick, well-priced breakfast (not just donuts and pastries), give it a shot. You may just love their stuff.",Business Category: Restaurants,Review Stars: 3.0
This is the same as saying you want a good cheeseburger and going to McDonald's.  It was fine certainly not good. Very little taste to any of the items. I don't get the appeal.,Business Category: Restaurants,Review Stars: 2.0
Best Chinese food in Wesley Chapel.Great price. Always fresh to order.I have never had a bad experience with the food here.Shrimp are always fresh and big.,Business Category: Restaurants,Review Stars: 4.0
"This place gets a C grade from me. My ""Tuna Melt"" was cold and had almost no cheese on it they did the bare minimum and did I mention the lackluster salad FAIL guys.",Business Category: Restaurants,Review Stars: 3.0
We have a lot of artisan ice cream shops in LA so I was happy to come upon one in Nashville as well.  The people behind the counter don't even cringe when you ask to sample 5 different flavors so go ahead and ask.  Here is my five cents.  Salted peanut butter tasted too salty. More peanut butter less salt please.  Goat milk with red cherries is a little tart but definitely a good flavor.  Brown butter almond brittle has a good crunch to it.  Brown butter ice cream was also well received although it didn't make the final cut.  I like that you can mix and match flavors in your cup or cone.  The cone is a $1 extra I believe but you do get a small piece of the cone in your cup and its delicious.,Business Category: Restaurants,Review Stars: 4.0
Almost cried the pizza Mac n cheese was to die for. If you want to experience a life changing event come here.,Business Category: Restaurants,Review Stars: 5.0
"This is the Boston Pizza location that I'm most likely to frequent. I've been visiting for well over a decade now and while the staff has been varied over the years, I've enjoyed visiting here at various times of day for various reasons. My most recent visit was during the early afternoon for Boston Pizza's 50th anniversary because of their $5 pizza promotion (which was indeed just $5! I did tip, of course as my service was great).  In the past I've visited in the late night after ballroom dance events, late morning for an early lunch and every time period in between on weekdays and weekends for gatherings with friends, alone or on a date. And while the food is the standard fare that all Boston Pizza locations have, this location is fairly consistent with service. I tend to get better service in the restaurant section (and I use this area more often) rather than in the lounge, but I've definitely visited both.  I like the fact that Boston Pizza is a good place to go and relax over a meal or drinks or snacks, or dessert for a few hours and not have to be terribly rushed, but where you can get in and out in an hour or less if need be. The patio is nice on a summer day as well.",Business Category: Restaurants,Review Stars: 4.0
"First time trying the ""famed"" sandwich.  If you like the taste of spicy sauce and pickles,  good for you. Gross, I wont ever go to Popeyes again.        .",Business Category: Restaurants,Review Stars: 1.0
"Make sure you're going to the right address! My GPS sent me out to the boonies first.   Better than I expected. Had the pulled pork dinner. Pork had a good taste to it, juicy. Onion rings were good.  Nice fire going inside, it wasn't too cold... :-)  Quick and friendly service.",Business Category: Restaurants,Review Stars: 4.0
"You can enjoy a wide variety of selections from Western foods to Asian foods.  They are pretty delicious. However, they have a system where you eat first and pay later. If you are a senior citizen or you are with a senior citizen, make sure you spell it out and tell them that. Otherwise, they will not give you a senior citizen discount even if it's obvious that you are a senior citizen or you are with a senior citizen. i found out later when I looked at my bill that they didn't give my mom  who is a senior citizen a discount, even though we mentioned it to them earlier, and even though they could see that my mom is in her 80s.  I find this a bit dishonest that they didn't subtract the discount from the billl. So, I called them about it and explained what  they did. They were aware and willing to give us the discount. That would just cause such inconvenience for my mom and all the parties involved were already home.  The point is that they should not do that because it's not good customer service.  So, even though I enjoyed the food,  the way they try to not give a senior citizen a discount if the restaurant is not told that he/she is a senior citizen, even if it's very obvious,   is a bit  dishonest.",Business Category: Restaurants,Review Stars: 2.0
The food was low quality. Not really any authentic Mexican food. The service was good though.,Business Category: Restaurants,Review Stars: 3.0
"This place was much busier and bigger than I could've ever imagined.  I can tell by the amount of people here they are good.  I took my first bite into a juicy, steamy, almost puffy like a steamed egg charbroiled oyster and about fell off my chair.  Wow!!! Now that's an oyster!!!",Business Category: Restaurants,Review Stars: 5.0
Ok so I'm at McDonald and they said there not serving sausage mcmuffins doesn't the sign say all day breakfast  so that got me mad,Business Category: Restaurants,Review Stars: 1.0
"Reliable, open late and they deliver. Very yummy spinach and artichoke dip. Very decent pizza. There stromboli is pretty good too.",Business Category: Restaurants,Review Stars: 4.0
"Had lunch there today. Was warmly greeted when i stepped through the door, since it was my first visit I wasn't sure what to order so I decided to go all in, I ordered half a chicken, coleslaw, and okra. It took about 20 minutes to get my lunch, but considering they make every order from scratch that's no big deal. The chicken came out piping hot yum yum! Not greasy at all and a little spicy, but that's how they season it there. The okra was perfect tasty and fresh not slimy. I can't rave about the cole slaw it was pretty standard stuff much like KFC's. The servers kept checking on me to see if I needed anything, they were very friendly. I couldn't eat it all and got a take away container, the pieces of chicken they serve are really big!",Business Category: Restaurants,Review Stars: 4.0
"First visit, went with Mom and husband.  Now, since you're already in the Hard Rock and spending an afternoon and night, you don't leave to eat.  This option was already in thought when we went, so we made a reservation and reserved a booth.  Reserve the booth if you haven't - it's a great view.  There's all of 3 of them.  Facing the all glassed in kitchen.  Very nice kitchen.  Clean, neat, watch your steak get grilled.  So my husband had the Cowboy ribeye.  WOW it's pricey.  Not his favorite cut because it's so fatty.  It was good, but he wouldn't do that steak again. Nice touch with the huge bone and his initials carved into it.  But he'd go with a strip steak next time.  My porterhouse was nice.  A little too much fat on the strip side for me. More leftovers for dinner 2 nights later....  It was good, but I wouldn't get it again for that price (everything is a la carte like a lot of steakhouses, but not all....)  My Mom got the pork chop milenesa.  Now.  This was FABULOUS.  I had some of it for leftovers 3 days later and OMG it was WONDERFUL and one of the less expensive entree choices on the menu.  Seriously spectacular.  We had a shrimp cocktail  It was 4 jumbo shrimp.  For $18.  Really?  They could have done 6 shrimp and at 3 bucks a piece would have still made a killer margin on them.  They were good, don't get me wrong, but not worth $18 for 4.  The cocktail sauce was awesome!  We had the lobster bisque.  I split it with my husband.  It was really good.  Top of the line.  One of the best, flavor-wise.  It was just a tiny bit loose.  Overall, very very good.  And we would get it again and split it!  We all 3 split one salad.  It was definitely enough.  We all split a side of garlic mashed potatoes.  They were good.  And we all split the tower of onion rings.  They were oily and don't reheat well (even broiled).  Overall, we'd go again but we wouldn't get those steaks and wouldn't make a special trip. Now that we have experienced quite a bit on the menu.  We still have to try the seafood side and we will order much less food!  We didn't get to try dessert - will have to save room next time.  Added note: Forgot to mention that they have live music, sometimes a trio, sometimes acoustic, sometimes a solo artist.  Have been here since this last review and sat right in front of the stage to listen in on the great music!",Business Category: Restaurants,Review Stars: 4.0
"Sitting here at Guadalajara Grill we are longing for just the basics of good Mexican food. Sadly we have finished our homemade salsa and decent chips with the Dragoon IPA's-the best of the meal we ordered today.  The combination of poor quality tortillas and sweet red sauce ruined the experience of a decent Mexican comida. It is sad this is a busy establishment but quality is so poor. Last week we enjoyed a modest but superior Mexican food at the Conoco Filling Station in Raton, New Mexico( Thank you,  Two stars for the service, cold local beer and salsa.",Business Category: Restaurants,Review Stars: 2.0
The food is the only reason this place is getting 2 stars.   Service was HORRIBLE. Waited 30 minutes for food and they brought the apps out with the entrees.   3 of our 5 ordered a second round of drinks and only one of them ever came out.   Told him at the beginning that were all separate and he only brought out 3 checks...  Maybe take out is the way to go here...,Business Category: Restaurants,Review Stars: 2.0
Very good!! My first carry out experience was a great one! The pizza was A M A Z I N G. Very fresh and a really good size. I was super impressed! It is definitely a top pizza joint.,Business Category: Restaurants,Review Stars: 5.0
"Our server was quick and attentive about refilling our drinks, which was especially impressive since we were there during a football game and it was pretty packed.    The food was meh.  The upstairs was open air (translate: HOT and muggy because it's September).    The music, however, was fantastic.  Is there a better bar song than ""Sweet Caroline"" live?  I think not.    It has a very college-y feel to it.  I would probably try some place else next time.",Business Category: Restaurants,Review Stars: 3.0
"Was here for work and wanted Italian. Came in and looked at yelp on iPhone just to see what is recommended, since got bored from the SLOW service from the servers.   Then saw the 1 - 2 stars reviews. Oops.  Well since I ordered my beer already, I was too lazy to get up and go. I mean the food was alright afterward, but definitely service needs more attention to customer.",Business Category: Restaurants,Review Stars: 2.0
"Good Americanized Mexican food. It is not traditional but then again who is expecting that? Their food is consistent. Try the chicken taquitos! They are great. I've heard good things about the burritos too but haven't tried them myself. Warm chips and salsa are a nice touch. Oh, the staff is super friendly too.",Business Category: Restaurants,Review Stars: 4.0
Went here for restaurant week and all the food was amazing and very high end! Service was fast and very accommodating.,Business Category: Restaurants,Review Stars: 5.0
"Wanting to help out local businesses during the pandemic, we've been visiting local restaurants. Went across town for tenderloin sandwiches at Dooley O' Toole's. We were overcharged for our pick-up order. On contacting them we were told they would not credit our card, and would have to drive back for a cash credit. Obviously, we will not be going there again or recommend to anyone. Bad business practices!",Business Category: Restaurants,Review Stars: 1.0
Great service!! We loved our server! The lemonade was perfect and our cheesecake was to die for!  My friend ordered the lemon cake and wow',Business Category: Restaurants,Review Stars: 5.0
Tried Corkys again last night.  There were two customers in the restaurant and it still took forever to get a Pig Pen Salad and a barbecue sandwich.  The portions were smaller and with two drinks the total was $34.  The value is just not there.  I do not plan to go back. There are many other better values and choices.,Business Category: Restaurants,Review Stars: 1.0
I've been to it's nuts on Route 29 Titusville and we always enjoyed eating there. However the Lambertville location was just a horrible experience. I called to order two dinners of fried chicken. I asked the woman on the phone how long it would be until the food would be ready she said to come now. When I arrived they told me that the french fries were not cooked and it would be a wait. I'm waiting for 10 minutes and they didn't even cook my fries yet. I told her I didn't want to wait anymore to just give me mashed potatoes instead. So she proceeded to hand me my food and it seems like it was a bit much. I ordered two dinners with two pieces of chicken each and she gave me 12 pieces of chicken. There were people standing around and obviously not caring about my order I had put in. I will never go back I think the service and the food is not good at all. I hope they read this and improve how their business is being run,Business Category: Restaurants,Review Stars: 1.0
"I'm a fan mostly for their weekday lunch service. This place can get very crowded but the efficiency remains. Food is good, nothing spectacular but certainly worth going again. Yay, I'm certainly a fan.",Business Category: Restaurants,Review Stars: 4.0
"Take out order # 149862at 7:16 PM: ordered & picked up at counter.  Waitress (new) - Briana....very polite, efficient, well mannered, & excellent appearance. Double Steakburger - excellent  Single Steakburger - excellent Small French Fries small - excellent   Evening Manager (female) - Extremely efficient, & polite.....top notch quality!!!",Business Category: Restaurants,Review Stars: 3.0
"The food was good and the service pretty good. The waitress very pleasant and knowledgeable but could have been more attentive. BUT, 5 of us dined on  Saturday night and it was SOOO loud inside as to be stressful and unpleasant. Impossible to carry on a conversation.",Business Category: Restaurants,Review Stars: 2.0
"Got in the mood for a meal on the beach, the sunset, and live music -- haven't been since pre-COVID, but figured this would be the perfect place this end of the beach. I wish they had clam strips like Frenchy's does, but I opted for their chicken wings and a side salad, my wife got the seared tuna. Both were AMAZING, yes even for something normal like wings. Live musician did great (some of the music they play during sets is too hard for this crowd and sunset), and our serve ""Mo"" was great -- very attentive and we didn't feel neglected even with such a large crowd. We waited for a table out on the porch so we'd have sunset views, but then as it was setting a small crowd from inside came out to stand and watch and blocked our view... that's on them though, rude tourists. The drive out from Oldsmar was worth it, and we are already talking about a couple of family dinners here.",Business Category: Restaurants,Review Stars: 5.0
"Favorite Mexican in town. Best salsa, great food and prices. Very consistent lightning fast service. Very nice staff! Been eating here for years!",Business Category: Restaurants,Review Stars: 5.0
