text,label1,label2
This was by far the worst visit... no pretzel dogs were made... the girl at the register seemed to be in a rush to leave! And then I asked for two pretzels in a bag to go and when I get to work they are both burnt!! Gross!!! The slogan says we're so much more than just fresh pretzels! Maybe we should focus on getting a nice soft pretzel like your slogan!,Business Category: Restaurants,Review Stars: 1.0
The only thing good here are the drinks and the location. They dunk their tacos in a tangy red sauce that does not complement the food at all. There were seven of us that ain't here and not one person enjoyed their meal. Things tasted very bitter and dry.,Business Category: Restaurants,Review Stars: 2.0
"6 beers ordered for a group of 6, all beers flat!!! Brought it to the attention to the bartender, didn't acknowledge and didn't concern him. Not a good experience when you're drinking flat beers.",Business Category: Restaurants,Review Stars: 1.0
"Poor service, poor quality  & somewhat over priced. Tourist trap.pretty awful food run down facility with zero atmosphere. If you really want good Mexican go about a Block & 1/2 towards the bridge.",Business Category: Restaurants,Review Stars: 1.0
"Ate here Thursday June 12th.  It was roughly 9:00PM, I had crawfish etouffee, my wife had gumbo and shrimp, and my son had shrimp.  The food was ok kind of bland I have had better for less.  The service was so/so due to we always had to flag down someone because we were rarely checked on and the place really wasn't busy.",Business Category: Restaurants,Review Stars: 3.0
"Not bad, just not very good either. Cosi is one of those places I've been to so many times over the years and yet no one experience is significant enough to warrant even much of a review. The food is mediocre (at best sometimes) and the fact that they don't have any table service is both a plus and minus at times. Really, the only reason I bother going here is if I need to meet someone for a quick bite but need it to be more substantial an establishment than the deli for a sub. The salads are wilted and sad most of the time (although huge). The sandwiches are pretty pathetic and waayyyy overpriced for what you get. The only real plus is the squagels (square bagels) but they stop serving those at 11am so I rarely have a chance to get them. Basically, it's a good spot to grab a quick (albeit boring) lunch on Walnut street.",Business Category: Restaurants,Review Stars: 2.0
"We've been here at least twice.  The first time was excellent!  However, the second time which was around May/June, a few strange things happened.  First, our food took an exceptionally long time.  Second, someone who we thought to be a substitute chef, came out to apologize for having left an item off of one of the dishes (it wasn't one of ours).  Third, our server took our bill and cash and didn't come back (which would have meant an exorbitant tip).  We had to ask the other server to go find her.  We were one of the last two couples in the restaurant, so it wasn't as though they were really busy.  Very strange.  We just noticed they changed their concept to a more casual café, so we're not sure if we'll return.",Business Category: Restaurants,Review Stars: 2.0
"Better than usual meal.    Thai curry style mussels - tasty and spicy with cocoanut milk Burger with foie gras - always a winner - consistently good, nice and crispy sweet potato fries Duck breast with sweet potato purée and corn relish - very good - the duck could have been a bit rarer Salmon filet with celery root purée and orzo, fennel, kalamata olive salad special- very yummy.  Perfectly cooked salmon.   Macadamia nut cheesecake - moist and creamy with toasted macadamias and caramel sauce - almost took an extra slice home.  Service. Not as good.   Listened to the male.  Ignored the female.   Guess she( the waitress) didn't know who was calculating the tip tonight.",Business Category: Restaurants,Review Stars: 4.0
"The food is good but the online menu doesn't seem to match the menu in the restaurant. At least for what I tried to order. I ordered online and went to pick it up about 20 or more mins later. When I got there, they hadn't even started cooking my order, so I had to wait, which wasn't a big deal....BUT then things kinda went left. I ordered an entree based on the description on the menu. What I got was totally different. Tried showing them the online menu to let them see that what they gave me doesn't match. But they said I received what I ordered. They did offer to remake it but at that point I didn't have the time, and it almost seemed like what I ordered was not even a menu item. They did refund me. And the food I've eaten from here in the past was good. But  this was a crummy experience.",Business Category: Restaurants,Review Stars: 2.0
"I grew up loving Steak 'n Shake. At the time, they were only located off of interstates so it was a treat to get a steakburger, shake, and shoestring french fries. The service was always excellent and the food was fresh. This particular location doesn't embody that legend. The servers are nice but always seem stressed out and short staffed. If they forget a straw, napkin or you need something extra, be prepared to wait a while. The food is mediocre at best and seems haphazardly prepared. The restrooms could use a total remodel. Over all, I think I will satisfy my SnS cravings at a different location....at least until this one gets new management.",Business Category: Restaurants,Review Stars: 2.0
"If I could give this place 0 stars I would: they charge my boyfriend a 18% tip for going to eat with his family. The service was horrible. He waited over 8 minutes to get one refill of water. The server never checked in to make sure anything was okay. She was one of the worst servers I've ever had. Pinkish mask on, short with brown hair. I called to speak to the manager & they passed me to the busboy. Not the manager. Beware of this place. They said they charge parties of more than 12 a 18% gratuity. 2 of those ""12"" people didn't eat. You do the math. This place is pathetic with very pathetic people working. Educate your waiters because that rude little girl said 12 or more, oh & your busboy/owner. Lmao. Also try replying to other reviews as well. They would like to hear back from you too, those people were very disappointed with service & food as well. Make that right for them!",Business Category: Restaurants,Review Stars: 1.0
"After my first time at Serpico, I left impressed but not wowed by what I ate.  Sure, certain portions of my meal were wonderful but I hadn't experienced the bliss that I was expecting to get when I went into the meal.  This was unfair of me and on a subsequent visit I was thoroughly impressed and have officially become a fan of this place.  What impressed me the most about Serpico was that even though the house was packed, with all seats full, both in chairs and at the counter (where I sat), the kitchen didn't seem to miss a beat.  They just kept on in perfect fashion and food just kept rolling out.  Big props to the staff on that.  The hand torn pasta that we shared was peculiar because on first bite I wasn't expecting the taste of snail.  As I continued eating it though, it grew on me and by the end of the dish, I really enjoyed it.  The pig tail, a special that evening was marvelous.  It was falling of the bone and sitting on a bed of polenta that had hot sauce all over it.  I think the kitchen was having fun and I appreciated eating what they turned out.  The lamb ribs for two also did not disappoint in the least.  It was a hefty portion and the texture on this dash was also fantastic.  The yogurt was an excellent opposite flavor to the spicy vegetables that were also alongside the meat.  The sauce for the ribs themselves tasted very complex and was sweet, salty, a bit sour and just left me puzzled as to how they made it.  It looks like Serpico is here to play and I like it.  I was unsure how they would fit on south street but it seems like people are filling the seats and the kitchen is putting out the good stuff.",Business Category: Restaurants,Review Stars: 4.0
"Awful, was told 20 mins. Waited an hour and everything was cold. The people at the counter where very rude..never going back",Business Category: Restaurants,Review Stars: 1.0
These wings were soggy tasteless & a waste of $12 & who the hell puts sliced garlic cloves on wings NEVER AGAIN !,Business Category: Restaurants,Review Stars: 1.0
"I ordered my food here through Yelp/GrubHub. Two hours and ten minutes later, I get a notice that my food was just picked up. I called the restaurant and she said my food had been sitting ready for pick up for over an hour. She said that Yelp and GrubHub always take forever and to order from their website or Uber Eats. I am very disappointed that I not only have waited for over two hours (still haven't gotten it) but am expecting cold food with melted ice in my drink. What a shameful way to run a company literally made to review and rate services. And I paid a $4.50 fee to use the service? Disgusting! It's not about the restaurant, it's about the delivery services I paid to use for what I THOUGHT would provide convenience.",Business Category: Restaurants,Review Stars: 1.0
"Easily one of my favorite restaurants in all of New Orleans.  An Asian/Latin/Cajun/Creole fusion spot, in an unassuming part of lower Mid-City.    It's a fairly small restaurant, with some back courtyard seating, a long bar, and a few tables inside.  The grill and line are visible from the bar, which always makes for a show.    Some of my favorite menu items:  Lemongrass chicken tacos (can order just a single, or 2 or 3!)  Tater tots!!!! Hot sausage  Italian beef Dr. Tan burger Chopped salad.... I could go on!   Great spot to grab a beer, watch the game, grab a quick lunch, or a date night dinner.  Mellow atmosphere, and the service is always friendly.  Parking can be a little precarious, but I've always found a spot.",Business Category: Restaurants,Review Stars: 5.0
At least 3 times in the morning they open 1/2 late (yes I checked the time on the door).  No one at drive through but when you go up to the window the female employee made eye contact then walked away like she did not see you.  Wonder if anyone else can be late to work that often and not get fired?,Business Category: Restaurants,Review Stars: 1.0
"I often go to pho cali because I don't know other vietnamese restaurants in philly. The spring rolls are pretty good, but the grilled pork egg noodle is just fine. However, the service is poor. I am sure that lots of customers at pho cali always see the unfriendly female owner.   One day, I ordered the grilled pork noodle with soup on side because I normally ordered soup in the bowl. Surprisingly, when the soup was on the side, the noodle tasted better, but the bowl of soup is really small. When my soup almost ran out, I asked more for a bowl of soup.  Then she unfriendly told me that ""next time if you want more soup, just put it in the bowl. This is the way we do""   I was upset. just a bowl of soup... why didn't she just bring it for me right away and charge me for this? She made me feel like it was too much to ask for another bowl of soup.   I was a loyal customer there but I am no longer.   Besides, she never smiled at me once.",Business Category: Restaurants,Review Stars: 2.0
"I'm writing this review during the pandemic and I've taken it into consideration. We ordered three entrees to go tonight. They were all terrible. We've eaten these same entrees there many times and have always loved them. For $80 tonight it was so disappointing. Pasta was overcooked and a gelotinous mass, chicken overcooked and tough, sliders 1/2 meat to the ratio of the bun and they got the order wrong. Looked forward to this all week. So disappointing.",Business Category: Restaurants,Review Stars: 1.0
"I came in late and it was very quiet in the restaurant as they were close to closing time. A couple of people came in while I was eating for takeout orders but that was about it. Good portion sizes and fresh fish, I enjoyed their steaming hot bowl of udon on a chilly evening. Friendly service who checked up on me frequently and received my food promptly. Overall, a solid choice in a classy atmosphere.",Business Category: Restaurants,Review Stars: 4.0
My girl and I decided to go to this Applebee's just to enjoy our night & have some drinks but of course we got horrible service ... We sat down for 30 min before being served & when the server finally came back up to us she told us to hold on because she was busy no water no menus no nothing ! Not only that the weird ass hosts stood there starring at us the whole time .. (super creepy) I asked the manager to see what was going on & she did super nice & professional & then the server comes back mad & aggressive asking me did I tell the manager she wasn't doing her job & I said yes I did ! That was pure bullshit and she served us cold spinach dip.  Not to mention she walked passed the table 5xs like I was supposed to be scared or something ! I will be reporting this to corporate! And I will be putting names out because that was horrible & I kept my cool this time,Business Category: Restaurants,Review Stars: 1.0
"Their ""gluten free"" pizza is NOT gluten free. If you have celiac or allergic to gluten and you don't Enjoy feeling like shit for 48 hrs, don't try. You will regret",Business Category: Restaurants,Review Stars: 1.0
"Not a typical Indian restaurant,  no Bollywood movies! In fact the chefs aren't classically trained ""Indian"". If you are looking for gourmet INDIAN real deal? Then turn around and leave NOLA because I don't believe it exists.  I would say an Asian 'style' menu inspired mostly by Indian type dishes. It's a great bar scene, good fairly priced wine list. Good bar scene for the neighbourhood goin' on. WINE LIST = fair pricing.  Our group of three enjoyed our choices, which accommodated both gluten free ( Celiac) and dairy free. Flavours tamed down to cater for N. American palates, generous portions of good food. (Indian style, no tandoori oven stuff, it's Americanized okay?)  Muted big screen TV had a great old black n white film playing with silent captions making conversation easy peasy in the clean tidy comfortable room, great murals and ambience. Recommended.",Business Category: Restaurants,Review Stars: 4.0
Food was good BUT had to wait over an hour for our reserved table.  It was ridiculously loud downstairs.  They need to manage their reservations better and compensate their patrons in even a small way for the inconvenience of their mismanagement.  People waited closer to 1.5 hours right before us.  No need to return there!,Business Category: Restaurants,Review Stars: 1.0
"Good lunch specials. You can get a small soup, appetizer, and entree for like 10 bucks.  The food I had here was good. The ravioli soup was tasty, and the crab dumplings were super yummy (as was the plum sauce that came with them).  My entree was pretty OK, nothing amazing. I'd love to come back and try more things, though. The menu is huge and I really don't feel like I can form a true opinion of this joint without trying more stuff!",Business Category: Restaurants,Review Stars: 3.0
"I'm not sure what the rave is all about with this chicken under the brick thing...  but I did not like it.  It was loaded with salt; and it was pretty much a half of a whole chicken--way too big; and I like my portions big.  I really liked my friend's red fish.  It was delish and perfectly cooked; did not taste like fish at all.  Service was good, but I took a hit with going with what everyone else was raving about here on Yelp...  not doing the chicken brick thang when I go back.",Business Category: Restaurants,Review Stars: 3.0
"I think it's impressive what Vedge is trying to accomplish. It's hard to compete with other restaurants of a similar caliber in the area, especially without meat.  Dishes are creative and flavorful, but it seems like they use certain ingredients in excess to compensate. For example- avocado. Of course avocado is delicious! It would be interesting to see some other ingredients not normally associated with being tasty, turned into something delicious.  The desserts were very unique and delightful! Just the right amount, and not too heavy. They have very creative ice cream flavors.  5 dishes total for two people was a perfect amount of food. Not too full, not hungry afterwards.   Apart from the food, the service felt like we were in an assembly line. The food came out very quickly. We ate all our food, drinks, desserts in less than an hour. It wasn't so much of a dining ""experience"" as it was an attempt to turn over tables quickly.   All in all, it is over priced for vegetarian dishes, but they get some points for creativity. I think it's worth it to check out. Obviously an excellent choice for vegetarians.",Business Category: Restaurants,Review Stars: 3.0
Their mac and cheese is to die for. Their décoré is beautiful. Our waitress was very kind and the service was very fast.,Business Category: Restaurants,Review Stars: 5.0
"Not impressed with their service. Accidents happen and it how you handle them that counts. Making jokes instead of giving an apology does not make the problem go away. The GM needs training on customer service skills or just needs to be demoted to bus boy.   Waitress brings a tray full of water. She appears to be struggling with it. Places one glass then the the next slips from her grasp and falls right on my lap. I am now drenched in ice cold water. She is apologetic and goes to get me 2 napkins to dry off with (ok?) The GM comes over to the table and instead of asking what he can do to help he cracks a joke about how the rain and me being wet! I asked him if he thought this was funny and he left without comment. After that the waitress decided our table wasn't worth her time and there was no attempt to rectify the situation. We paid the bill and verified if he was actually the manager only for his reps one to be ""its only water."" I ended up buying new pants so we could go watch the movie we had planned. I won't be going back to this location.",Business Category: Restaurants,Review Stars: 1.0
"We went here with our 7 and 9 year old boys (steak fans) 9/13/19.   I had a royal sazarac, followed by a filet and Mac&cheese, boys split a filet and fries, and momma had a sangria followed by a ravioli of lobster and buratta.     For dessert, mom and the youngest split a chocolate cake, and I split a bananas foster with the oldest son.    Our server John was awesome (seriously, someone needs to give him a pat on the back and a raise, he is a first class host!).  We were taken care of in superb fashion, and wanted for nothing.  The food was sublime, and my wife was very happy that ""this sangria is NOT watered down"".     John allowed our boys to ""help"" prepare the bananas foster, which was a huge hit, and really made their day, as well as some of the other patrons who enjoyed the spectacle.     A true class act, and yet another outstanding restaurant in a city full of amazing restaurants.  If you have not been to Emirils Delmonico, you are missing out, give them a shot.",Business Category: Restaurants,Review Stars: 5.0
Always enjoyable and always delicious! Food and beer is top-of-the-line! The darker lighting is one of my favorite aspects of Two Stones Pub - it gives it a very cozy and warm feeling. The waiters and waitresses are always there And they are extremely helpful whenever you need any kind of service... It would appear that they hire a lot of people just for that reason. I highly recommend Two Stones Pub to all my friends and to anybody that reads this!!!,Business Category: Restaurants,Review Stars: 5.0
"This was my first visit to this place, my had been here before and said it was good. We decided to come and try it out together, the place was a little loud, there were several people that left due to the volume of the music but whatever we stayed. I ordered an old fashion which was good. We ordered the stinky buns, they were good as well, I ordered the duck tacos which were a little on the cheap side with portion servings of the duck, but extremely heavy on the cabbage! Which also made the tortilla moist due to the water cabbage retains. But all of this was ok, until it was time for our bill it took more than 40 min to get our bill, and to get out of there because our waitress was to busy having drinks, and siting with another table, so we had to go to the host stand and ask for our bill, and pay for our bill there. So if you do happen to go, make sure your waitress isn't Ms.Xtina G.",Business Category: Restaurants,Review Stars: 2.0
"We came on a college night, so our IDs were checked at the door. No big deal of course, we're overage. This was the 4th place we went to on our bar hop and got there around 9, and at that time until 11pm, mixed drinks are just 3 bucks. So that's a pretty unbeatable deal. Unless of course it's 2 or 1.   I had a bourbon and ginger and the wife started with a vodka and cranberry. While we were drinking we looked at the menu and ordered an appetizer. We got the cheesesteak egg rolls. These were pretty good served with a mayo and horse radish sauce. It was my first time having horse radish purposely to my knowledge and was happily surprised with the flavor. I'll be looking it up after this review.   As we waited for our appetizer, my wife saw a blue drink across the bar and asked if it was a blue motorcycle, but we were told it was a Great Piece of Ass. A name I know lol! But it was very tasty. Not too sweet and one where the alcohol will sneak up on you later...not a story for Yelp. Lol!   The place wasn't very crowded at all and the environment was cool and laid back. Most folks kind of kept to themselves. There is a nice sized dance floor here though, so the place has the potential to be a nice after hours venue. It was my first time, so it'll take a few more visits to kind of bet the read on this place.   I had a good time here and I'd go again.",Business Category: Restaurants,Review Stars: 4.0
"The service is always excellent and the food is amazing. We have family members with Celiac's, so we have to be careful about where we go. Highly recommend.",Business Category: Restaurants,Review Stars: 5.0
"Let's be honest.  Pho 21 sounds like it would be a good, inexpensive lunch place.  Unfortunately, it isn't that good.  The noodle bowls taste like nothing more than noodles in hot water.  There is almost no flavor.   The only thing that saved this place from a 1 star rating from me is the raw spring rolls.  I would go there just for the spring rolls to be honest.",Business Category: Restaurants,Review Stars: 2.0
"Very good Texas Wieners, very cheap prices and you kind of get that local feel when you walk in they usually remember your order if you go in there enough. But they do give you big portions for cheap prices. my only complaints for the place no open late enough and not open on the weekends!",Business Category: Restaurants,Review Stars: 3.0
"I ordered the Patty Melt and fries. What I got was a burger with onions, a little bit of some kind of sauce I couldn't taste that had way too many poppy seeds, and a tiny bit of cheese on rye bread. That's not a patty melt. Needless to say it was pretty disappointing for $9. I threw most of it away because it just wasn't good. The fries were fine - they were the highlight of the meal even though they were really just okay and nothing special. I'm not in a hurry to go back.",Business Category: Restaurants,Review Stars: 2.0
"Harvest restaurant Oro Valley Have been to the Harvest for lunch on numerous occasions...the food is consistently good.  However, the staff has been consistently bad until a new hire about a month ago.  The service staff desperately needs customer service basics.  They act bored for the most part and are definitely in no hurry to wait on customers..Oftentimes they appear to been awakened from a nap. Need service to match the quality of food",Business Category: Restaurants,Review Stars: 2.0
I visited this location once a week ago. The experience was OK. The server was pleasant and the food was OK. I visited a second time with some people from work who wanted to try it and this visit decided i would not be eating here again.  The service was poor and inattentive. The food was very basic. The quality of the food is really no better than some frozen food dishes you could make and in some cases the frozen TV dinner option would be better. This is unfortunately one of those places that sets the appearance of quality food but lacks the food to back up the image they are selling.   there are plenty of better places to eat for similar style cuisine near this location.,Business Category: Restaurants,Review Stars: 2.0
"We had dinner here last Friday, and I realize this is a new restaurant that's still launching.....   That being said, we started with the burrata and it was pretty good. The issues occurred doing the main course. I ordered the scallops and no where on the menu informs the diner that they are RAW. I was anticipating this ""southern comfort food"" dish not sushi. My server attempted to explain that they are torched- the scallop was cold and raw.   We also ordered the crab Mac and cheese and it was okay- not great.    Our service was great and our waiter was good. Drinks were interesting.   I think the chef needs to pick a direction, stick with it, and execute it.",Business Category: Restaurants,Review Stars: 3.0
"Nice old fashion Cajun style seafood restaurant, if you come during dinner time, expect the wait to be long! Strong recommend their blackened alligator!",Business Category: Restaurants,Review Stars: 4.0
